title, author, cover, isbn, price
Dune, Frank Herbert, https://images.isbndb.com/covers/35/93/9780441013593.jpg, 9780441013593, 9.99
The Fellowship of the Ring, J.R.R. Tolkien, https://images.isbndb.com/covers/02/38/9780358380238.jpg, 9780358380238, 19.99
Crime and Punishment, Fyodor Dostoevsky, https://images.isbndb.com/covers/45/05/9780679734505.jpg, 9780679734505, 8.95
The Metamorphosis, Franz Kafka, https://images.isbndb.com/covers/76/63/9781557427663.jpg, 9781557427663, 4.98
The Complete Fiction of H.P. Lovecraft, H.P. Lovecraft, https://images.isbndb.com/covers/94/84/9798634859484.jpg, 9798634859484, 29.90
Cats, Fluffy Meowingston, https://cdn.britannica.com/91/181391-050-1DA18304/cat-toes-paw-number-paws-tiger-tabby.jpg, 7777777777777, 7.77);
GOAT, BAAAAAAAAAA, https://upload.wikimedia.org/wikipedia/commons/thumb/f/f3/Goat_with_unusual_horns.jpg/400px-Goat_with_unusual_horns.jpg, 66606660666, 6.66